{
  "id": "dev-amd64",
  "status": "candidate",
  "architecture": "amd64",
  "memoryMiB": 16384,
  "network": { "northbound": 1, "southbound": 1 },
  "tpm": true,
  "accelerator": {
    "type": "none",
    "passthroughQualified": false
  },
  "eve": {
    "architecture": "amd64",
    "release": "PIN_BEFORE_QUALIFICATION"
  }
}
